{"compatibility":{"hash":"76cc7a5ec2bdad2509946e1426e368292925a41eaa5145a190136a553ea35782","space":"rapp/1:wave"},"compatibility_payload_hash":"c77019d4e4c9ac3357847f375a5600baea22f0dd056ecee41f08988145fcf0d6","compiler":{"bytes":19890,"executable":false,"media_type":"text/x-python","particle":{"hash":"9d49cb6d715766b401387932c5f76b3e89089cc09caacc2ca843f042365116d6","space":"rapp/1:particle"},"path":"reference/validator.py","role":"static-agent-compiler","sha256":"64fee0d69583310fd6da4014968a6f57c39d2f4f11135a3208a870a72a7d30bd"},"deterministic":true,"generated_tests_are_independent_proof":false,"grants_authority":false,"options":{"hash":"28cdced717a780c5f643b3c07e80b26849aa9c675f8cdc019ae7584110ce78d8","space":"rapp/1:particle"},"output":{"bytes":6026,"executable":false,"media_type":"text/x-python","particle":{"hash":"c59b4d8253c2901d5cffec4d29ce2aa30040ca777492b9ede921274611f27c59","space":"rapp/1:particle"},"path":"fixtures/softwarecoellc-vteam-hive/static-agent.py","role":"locked-static-agent","sha256":"cbc03c8059ec831a388d0b99dd3950453b711adb09d5e9e066fdbc785ff4c82f"},"runtime_sha256":"169cde589f5dda1539f12c188e85e713a197e01f6fc26d583413efe8637dad36","schema":"rapp-work-compatibility/1/static-agent-generation","tests":{"hash":"4ff04c4155bb96b1aef984db0fdafd7430619c61f059623d2e617b53e4b9d325","space":"rapp/1:particle"}}